{
  "$schema": "http://json-schema.org/draft-07/schema#",
  "$id": "https://roguetrader.local/schemas/moves.schema.json",
  "title": "Commander Moves",
  "description": "Schema for Commander character moves data",
  "type": "array",
  "items": {
    "type": "object",
    "properties": {
      "id": {
        "type": "string",
        "description": "Unique identifier for the move (must be unique across all moves)",
        "pattern": "^[a-zA-Z0-9]+$"
      },
      "title": {
        "type": "string",
        "description": "Display title of the move"
      },
      "description": {
        "type": "string",
        "description": "Detailed description of when and how to use this move"
      },
      "outcomes": {
        "type": "array",
        "description": "Array of possible outcomes based on dice roll ranges",
        "items": {
          "type": "object",
          "properties": {
            "range": {
              "type": "string",
              "description": "Dice roll range (e.g., '≥ 10', '7–9', '≤ 6')"
            },
            "text": {
              "type": "string",
              "description": "Description of what happens on this outcome"
            },
            "bullets": {
              "type": "array",
              "description": "Optional bullet points for choices or effects",
              "items": {
                "type": "string"
              }
            }
          },
          "required": ["text"],
          "additionalProperties": false
        }
      },
      "submoves": {
        "type": "array",
        "description": "Array of submoves, each with its own title, description, and outcomes. When present, these are rendered instead of the main move's description/outcomes.",
        "items": {
          "type": "object",
          "properties": {
            "title": {
              "type": "string",
              "description": "Display title of the submove (e.g., 'Give an order')"
            },
            "description": {
              "type": "string",
              "description": "Description of when and how to use this submove"
            },
            "outcomes": {
              "type": "array",
              "description": "Array of possible outcomes for this submove",
              "items": {
                "type": "object",
                "properties": {
                  "range": {
                    "type": "string",
                    "description": "Dice roll range (e.g., '≥ 10', '7–9', '≤ 6')"
                  },
                  "text": {
                    "type": "string",
                    "description": "Description of what happens on this outcome"
                  },
                  "bullets": {
                    "type": "array",
                    "description": "Optional bullet points for choices or effects",
                    "items": {
                      "type": "string"
                    }
                  }
                },
                "required": ["text"],
                "additionalProperties": false
              }
            },
            "pick": {
              "type": "array",
              "description": "Array of options for pick moves (multiple selections allowed)",
              "items": {
                "type": "string"
              }
            },
            "pickOne": {
              "type": "array",
              "description": "Array of options for pickOne moves (radio buttons, only one selection allowed)",
              "items": {
                "type": "string"
              }
            }
          },
          "required": ["title"],
          "additionalProperties": false
        }
      },
      "pick": {
        "type": "array",
        "description": "Array of options for pick moves (multiple selections allowed)",
        "items": {
          "type": "string"
        }
      },
      "pickOne": {
        "type": "array",
        "description": "Array of options for pickOne moves (radio buttons, only one selection allowed)",
        "items": {
          "type": "string"
        }
      },
      "multiplePick": {
        "type": "integer",
        "description": "Number of columns for pick/pickOne options (creates grid layout with separate selections per column)",
        "minimum": 2,
        "maximum": 5
      },
      "takeFrom": {
        "type": "array",
        "description": "List of roles this move can be taken from. Supports wildcard patterns: '*' matches any role, 'prefix*' matches roles starting with prefix (case-insensitive). Roles already possessed by the character are automatically excluded.",
        "items": {
          "type": "string",
          "examples": ["Navigator", "Mech Adept", "*", "the*", "Void*"]
        }
      },
      "takeCategory": {
        "type": "array",
        "description": "Optional array of categories to filter moves when using takeFrom. Only moves with matching categories will be shown. Moves without a category are treated as 'Moves' category.",
        "items": {
          "type": "string",
          "examples": ["Moves", "Equipment", "Advancement"]
        }
      },
      "takeMoves": {
        "type": "array",
        "description": "Optional array of specific move IDs to restrict takeFrom to. Only moves whose id is in this list will be shown (in addition to any other takeFrom filtering). Useful for granting a specific move with flavour text rather than letting the player pick from a whole role/category.",
        "items": {
          "type": "string",
          "examples": ["battlehard"]
        }
      },
      "takeFromAllowsDuplicates": {
        "type": "boolean",
        "description": "If true, allows selecting the same move multiple times from takeFrom. Each selection gets a unique ID suffix to prevent conflicts. Also disables filtering of moves already possessed by current roles. Default is false for backwards compatibility.",
        "default": false
      },
      "multiple": {
        "type": "integer",
        "description": "Number of checkboxes to show (for moves that can be taken multiple times)",
        "minimum": 2,
        "maximum": 10
      },
      "category": {
        "type": "string",
        "description": "Optional category for grouping moves (moves without a category appear first under 'Moves')"
      },
      "weight": {
        "type": "number",
        "description": "Optional numeric value to control move ordering within a category. Moves are sorted by weight (lower values first), while preserving the original order for moves with the same weight. Default is 0.",
        "default": 0
      },
      "grantsCard": {
        "type": "string",
        "description": "Card name to grant when this move is selected"
      },
      "details": {
        "type": "boolean",
        "description": "If true, shows a free text input field for additional move details",
        "default": false
      },
      "hideCheckbox": {
        "type": "boolean",
        "description": "If true and move is force-ticked via availability.json (set to true), the checkbox will be hidden while keeping the move content visible. Useful for moves that should look like part of the character sheet rather than selectable options, especially when combined with categories.",
        "default": false
      },
      "useTwoColumnsForSubmoves": {
        "type": "boolean",
        "description": "If true, renders this move's submoves in a 2-column grid (falling back to 1 column on narrow screens) instead of stacking them vertically. Only affects submoves; the rest of the move is unaffected.",
        "default": false
      },
      "tracks": {
        "type": "array",
        "description": "Array of tracking configurations for multiple resources",
        "items": {
          "type": "object",
          "properties": {
            "name": {
              "type": "string",
              "description": "Display name for the tracked resource",
              "examples": ["Inspire", "Hold", "Focus"]
            },
            "max": {
              "type": "integer",
              "description": "Maximum number of points that can be tracked",
              "minimum": 1,
              "maximum": 10,
              "default": 5
            },
            "shape": {
              "type": "string",
              "description": "Visual shape for the track counters",
              "enum": ["square", "circle", "triangle", "hexagon"],
              "default": "square"
            },
            "startLabel": {
              "type": "string",
              "description": "Optional small text label shown before the shapes (e.g., '0', 'weak', 'calm')",
              "examples": ["0", "weak", "calm", "none"]
            },
            "endLabel": {
              "type": "string",
              "description": "Optional small text label shown after the shapes (e.g., 'max', 'strong', 'breaking')",
              "examples": ["max", "strong", "breaking", "full"]
            },
            "dynamic": {
              "type": "boolean",
              "description": "If true, shows a 'max...' button to let user set custom max value",
              "default": false
            }
          },
          "required": ["name"],
          "additionalProperties": false
        }
      }
    },
    "required": ["id", "title"],
    "additionalProperties": false
  }
}
